{
  "email": "email@gmail.com",
  "languageName": "English",
  "linkedin": "https://www.linkedin.com/in/daniloneto/",
  "name": "Danilo Neto",
  "outputFileName": "Resume_Danilo_Neto.docx",
  "phone": "00-0000-0000",
  "sections": {
    "certifications": {
      "list": [
        "Microsoft Certified: Azure Data Fundamentals",
        "AWS Certified Cloud Practitioner",
        "Accenture Technology Architecture Associate",
        "Mongo SI Associate Certification",
        "Foundational C# with Microsoft",
        "Microsoft Certified MTA: Software Development Fundamentals"
      ],
      "title": "Certifications"
    },
    "education": {
      "degrees": [
        "MBA in Information Management - Salvador University (2009-2010)",
        "Bachelor's Degree in Information Systems - Salvador University (2002-2007)"
      ],
      "title": "Education"
    },
    "inProgress": {
      "courses": [
        "Berlitz English Course",
        "Github Copilot Certification"
      ],
      "title": "In Progress"
    },
    "professionalSummary": {
      "content": "Professional with a strong technical foundation in back-end and solution architecture, focusing on cloud environments (Azure and AWS), microservices, and distributed systems. Senior Consultant at Avanade, working on technical design, team leadership, and delivery of robust solutions.\n\nT-Shaped profile: technical depth (C#, Node.js, Java/Spring Boot), ease in transitioning between product, operation, and strategy. Motivated by well-structured systems, solid decisions, and consistent team evolution.",
      "title": "Professional Summary"
    },
    "technicalSkills": {
      "skills": [
        {
          "level": 5,
          "name": "C#"
        },
        {
          "level": 5,
          "name": "Node.js"
        },
        {
          "level": 4,
          "name": "Java / Spring Boot"
        },
        {
          "level": 5,
          "name": "AWS"
        },
        {
          "level": 4,
          "name": "Azure"
        },
        {
          "level": 5,
          "name": "SQL Server"
        },
        {
          "level": 4,
          "name": "PostgreSQL"
        },
        {
          "level": 3,
          "name": "MongoDB"
        },
        {
          "level": 3,
          "name": "Angular"
        },
        {
          "level": 3,
          "name": "Flutter"
        },
        {
          "level": 5,
          "name": "DDD"
        },
        {
          "level": 5,
          "name": "Microservices"
        },
        {
          "level": 4,
          "name": "TDD"
        },
        {
          "level": 3,
          "name": "SRE"
        },
        {
          "level": 4,
          "name": "Docker"
        },
        {
          "level": 3,
          "name": "Kubernetes"
        },
        {
          "level": 4,
          "name": "CI/CD"
        },
        {
          "level": 5,
          "name": "Git"
        },
        {
          "level": 5,
          "name": "Agile / Scrum"
        },
        {
          "level": 5,
          "name": "Azure DevOps"
        },
        {
          "nivel": 5,
          "nome": "Github Copilot"
        }
      ],
      "title": "Technical Skills"
    },
    "workExperience": {
      "jobs": [
        {
          "description": [
            "Technical team leadership (7 devs), code review, delivery practices.",
            "Scalable and resilient REST APIs (Node.js, Hexagonal Architecture, Java/Spring Batch).",
            "AWS Serverless Stack: Lambda, DynamoDB, RDS Postgres, EventBridge, SQS, API Gateway, S3.",
            "Observability: Dynatrace, K6 performance testing.",
            "SRE, reliability, and process automation.",
            "Previous projects: Azure, C# .NET Core, Angular/TypeScript, Azure Service Bus, TDD, DDD."
          ],
          "period": "Apr/2021 - Present",
          "position": "Senior Development Consultant - Avanade"
        },
        {
          "description": [
            "Development in C#, ASP.NET MVC, Flutter, SQLite.",
            "DevOps, Git, automation."
          ],
          "period": "Oct/2017 - Apr/2021",
          "position": "Senior Systems Analyst - SENAR AR/BA"
        },
        {
          "description": [
            "Systems Analyst - Open System (Jul/2017-Oct/2017)",
            "Systems Analyst - Tao Interativa (Oct/2016-Jul/2017)",
            "Mobile Developer - Safeticket (Dec/2015-Jul/2017)",
            "Developer - Indra (Apr/2015-Dec/2015)",
            "Independent Consulting (Aug/2010-Apr/2015)",
            "Substitute Professor - IFBAIANO (Nov/2013-Sep/2014)",
            "Systems Analyst - Expressa (Jun/2007-Aug/2010)",
            "Mid-level Developer - CPM Braxis/Capgemini (Dec/2004-Jun/2007)",
            "Junior Developer - M4F (Jul/2004-Dec/2004)",
            "Intern - Rádio Metrópole (2003)"
          ],
          "period": "",
          "position": "Other positions:"
        }
      ],
      "title": "Work Experience"
    }
  }
}